{
  "audit": {
    "audit_date": "2026-08-02",
    "audited_main_sha": "d511414daa0c7127c1e9cfdc64726979e6682e1f",
    "limitations": [
      "A conversation report is not independent artifact custody.",
      "External media-rich packs are not in the repository unless a manifest says otherwise.",
      "This ledger records the audited state; a later merge requires a new ledger revision rather than mutating history silently.",
      "Issue creation records obligations and sequencing, not execution passage.",
      "The PR #56 transport branch pointer drifted after terminal closure; only the closure head and harvested payload retain authority."
    ],
    "method": [
      "reviewed pull requests 1 through 52 and their stated scope",
      "verified ancestry for stacked and cumulative heads against audited main where exact heads were available",
      "compared preserved non-main branch heads to audited main",
      "reconciled source-free specimen manifests and proof receipts",
      "retained conversation-only claims as explicitly unbound reports rather than silently dropping or promoting them",
      "recorded PR #52 as squash-merged main authority only after its five review findings were resolved and its exact merge-ref gates passed",
      "reviewed pull requests 53 through 56 and their terminal dispositions",
      "verified current retained branch pointers against recorded terminal heads",
      "recorded the post-governance campaign fan-out in issues 57 through 68"
    ],
    "pending_pull_requests": [],
    "repository": "BigBirdReturns/earcrate"
  },
  "branch_retention": [
    {
      "authority": "PR #53 landed as 6da4a6111ed529cd470c5cec3f4a0a1988fc3a08.",
      "pointer_check": {
        "ahead_by": 0,
        "as_of": "2026-08-02",
        "behind_by": 0,
        "result": "identical_to_terminal_head"
      },
      "ref": "agent/canon-nonlanding-ledger",
      "status": "landed_frozen",
      "terminal_head_sha": "886040ceb7ca5e6782e5c19d69f696d6f97a9ccc"
    },
    {
      "authority": "Direction retained; branch scaffolding is not the material forge implementation.",
      "pointer_check": {
        "ahead_by": 0,
        "as_of": "2026-08-02",
        "behind_by": 0,
        "result": "identical_to_terminal_head"
      },
      "ref": "agent/forge-material-breeder-v0",
      "status": "deferred_concept_canon",
      "terminal_head_sha": "d27c0b1ac1ebf464ddec726105c5fdd546f02563"
    },
    {
      "authority": "Unique overlay workflow retired after ordinary source landed through PR #39.",
      "pointer_check": {
        "ahead_by": 0,
        "as_of": "2026-08-02",
        "behind_by": 0,
        "result": "identical_to_terminal_head"
      },
      "ref": "agent/gate8-canonical-integration",
      "status": "retired_delivery_mechanism",
      "terminal_head_sha": "3b70d343997470d7af93daa84558306db3abdf0f"
    },
    {
      "authority": "PR #52 landed as 36618a23f755b876e6d887be64a61389b5093e10.",
      "pointer_check": {
        "ahead_by": 0,
        "as_of": "2026-08-02",
        "behind_by": 0,
        "result": "identical_to_terminal_head"
      },
      "ref": "agent/harden-release-governance-v2",
      "status": "landed_frozen",
      "terminal_head_sha": "43245748702848053af970d88011479e0044e4c7"
    },
    {
      "authority": "PR #56 terminal transport head; exact payload was harvested into PR #55.",
      "pointer_check": {
        "ahead_by": 2,
        "as_of": "2026-08-02",
        "behind_by": 23,
        "note": "Current pointer is two commits ahead and twenty-three behind the terminal-head comparison base; no later pointer content is product authority.",
        "result": "diverged_after_terminal_close"
      },
      "ref": "agent/homelab-integrity-transport",
      "status": "completed_transport_no_authority",
      "terminal_head_sha": "ab9e89a4966f5656c3e86c0ce4d080e5e85e1100"
    },
    {
      "authority": "Snapshot/export mechanism retired after immutable project authority landed.",
      "pointer_check": {
        "ahead_by": 0,
        "as_of": "2026-08-02",
        "behind_by": 0,
        "result": "identical_to_terminal_head"
      },
      "ref": "agent/integrated-score-cutover",
      "status": "retired_snapshot_scaffold",
      "terminal_head_sha": "b307dd613ffc61c7efa2faea2e8d6fdb15ab8fdb"
    },
    {
      "authority": "PR #55 landed as d511414daa0c7127c1e9cfdc64726979e6682e1f.",
      "pointer_check": {
        "ahead_by": 0,
        "as_of": "2026-08-02",
        "behind_by": 0,
        "result": "identical_to_terminal_head"
      },
      "ref": "agent/local-estate-control-plane",
      "status": "landed_frozen",
      "terminal_head_sha": "d2444b507153acff90b0f3d3b80892ebf46afab0"
    },
    {
      "authority": "Single-file repository transport probe; not product work.",
      "pointer_check": {
        "ahead_by": 0,
        "as_of": "2026-08-02",
        "behind_by": 0,
        "result": "identical_to_terminal_head"
      },
      "ref": "agent/production-cleanup-inline-probe",
      "status": "failed_delivery_diagnostic",
      "terminal_head_sha": "45ef903f15dd3b813f51193371f688ab46cfad94"
    },
    {
      "authority": "Second repository transport probe; not product work.",
      "pointer_check": {
        "ahead_by": 0,
        "as_of": "2026-08-02",
        "behind_by": 0,
        "result": "identical_to_terminal_head"
      },
      "ref": "agent/production-cleanup-inline-probe-2",
      "status": "failed_delivery_diagnostic",
      "terminal_head_sha": "a0e19f4b9320ce551c6c6e1d61bfe3d3b00bcc9b"
    },
    {
      "authority": "Concepts were harvested; parallel authority was not.",
      "pointer_check": {
        "ahead_by": 0,
        "as_of": "2026-08-02",
        "behind_by": 0,
        "result": "identical_to_terminal_head"
      },
      "ref": "agent/release-candidate-discipline",
      "status": "harvested_competing_implementation",
      "terminal_head_sha": "18e3af22d03c32f280198ea4416c43abbb827357"
    },
    {
      "authority": "Export workflow and placeholders only.",
      "pointer_check": {
        "ahead_by": 0,
        "as_of": "2026-08-02",
        "behind_by": 0,
        "result": "identical_to_terminal_head"
      },
      "ref": "agent/release-candidate-review-floor",
      "status": "retired_scaffold",
      "terminal_head_sha": "0816d0cee08f77b1873fec9c03ee065db3154eda"
    },
    {
      "authority": "Export workflow and placeholders only.",
      "pointer_check": {
        "ahead_by": 0,
        "as_of": "2026-08-02",
        "behind_by": 0,
        "result": "identical_to_terminal_head"
      },
      "ref": "agent/release-review-floor-v1",
      "status": "retired_scaffold",
      "terminal_head_sha": "1249ab673e4250d4c5f8361a5712e1f031fe9f9b"
    },
    {
      "authority": "Candidate organs remain harvestable only through current contracts and real-rig receipts.",
      "pointer_check": {
        "ahead_by": 0,
        "as_of": "2026-08-02",
        "behind_by": 0,
        "result": "identical_to_terminal_head"
      },
      "ref": "claude/earcrate-v0.9.0-complete-wrz7lw",
      "status": "deferred_unvalidated_branch",
      "terminal_head_sha": "95cb411da8e99cafbd64b9f0769da77f7e0e2a99"
    }
  ],
  "campaign_fanout": {
    "audited_main_sha": "d511414daa0c7127c1e9cfdc64726979e6682e1f",
    "epic_issue": 57,
    "issues": [
      {
        "issue": 58,
        "priority": "P0",
        "state": "open",
        "title": "Run the first explicit-root, read-only estate sweep",
        "url": "https://github.com/BigBirdReturns/earcrate/issues/58"
      },
      {
        "issue": 59,
        "priority": "P0",
        "state": "open",
        "title": "Run the Flim exact-recording blind control",
        "url": "https://github.com/BigBirdReturns/earcrate/issues/59"
      },
      {
        "issue": 60,
        "priority": "P0",
        "state": "open",
        "title": "Seal Children audio inference and score/audio convergence",
        "url": "https://github.com/BigBirdReturns/earcrate/issues/60"
      },
      {
        "issue": 61,
        "priority": "P1",
        "state": "open",
        "title": "Regenerate Children receipts and execute a sealed rack realization",
        "url": "https://github.com/BigBirdReturns/earcrate/issues/61"
      },
      {
        "issue": 62,
        "priority": "P0",
        "state": "open",
        "title": "Run the Pretty Lights provider tournament and reconcile candidate revisions",
        "url": "https://github.com/BigBirdReturns/earcrate/issues/62"
      },
      {
        "issue": 63,
        "priority": "P0",
        "state": "open",
        "title": "Complete Pretty Lights human, rights, and publication governance",
        "url": "https://github.com/BigBirdReturns/earcrate/issues/63"
      },
      {
        "issue": 64,
        "priority": "P1",
        "state": "open",
        "title": "Circulate ReviewPatch evidence and prove campaign learning",
        "url": "https://github.com/BigBirdReturns/earcrate/issues/64"
      },
      {
        "issue": 65,
        "priority": "P1",
        "state": "open",
        "title": "Enforce Floor host boundaries and settle normative policy",
        "url": "https://github.com/BigBirdReturns/earcrate/issues/65"
      },
      {
        "issue": 66,
        "priority": "P1",
        "state": "open",
        "title": "Ship reproducible installable distribution and verifiable archive custody",
        "url": "https://github.com/BigBirdReturns/earcrate/issues/66"
      },
      {
        "issue": 67,
        "priority": "P2",
        "state": "open",
        "title": "Lower real-time MixScore, key lock, controllers, and external sync",
        "url": "https://github.com/BigBirdReturns/earcrate/issues/67"
      },
      {
        "issue": 68,
        "priority": "P0",
        "state": "open",
        "title": "Publish canon v2 and freeze the historical branch retention map",